{
  "schema_version": "1.0.0",
  "as_of": "2026-08-02",
  "scope": "Shanghai clean-energy and startup official policy monitor",
  "allowed_hosts": [
    "fgw.sh.gov.cn",
    "kjgl.stcsm.sh.gov.cn",
    "sheitc.sh.gov.cn",
    "stcsm.sh.gov.cn",
    "www.sheitc.sh.gov.cn"
  ],
  "sources": [
    {
      "policy_id": "SH-CT-2026-001",
      "title": "2026年度关键技术研发计划“绿色燃料技术”项目申报指南",
      "issuer": "上海市科学技术委员会",
      "document_number": "沪科指南〔2026〕17号",
      "source_url": "https://stcsm.sh.gov.cn/zwgk/kyjhxm/xmsb/20260713/1638fa0a03e445fc943942c0b847a5a9.html",
      "published_at": "2026-07-13",
      "application_open_at": "2026-07-13",
      "application_close_at": "2026-08-07",
      "status_mode": "application_window",
      "opportunity_type": "research_grant_call",
      "eligible_regions": ["上海"],
      "eligible_entities": ["企业"],
      "eligible_stages": ["research_development", "pilot", "early_commercial"],
      "sectors": ["绿色燃料", "绿色氨", "绿色甲醇", "动力装备"],
      "industry_tags": ["清洁能源", "绿色燃料", "氢能"],
      "stage_tags": ["研发", "试点", "早期商业化"],
      "need_tags": ["研发资助", "技术验证"],
      "technology_tags": ["生物质燃料", "二氧化碳合成燃料", "绿色氨", "绿色甲醇"],
      "geography_tags": ["上海"],
      "market_tags": ["绿色交通", "工业脱碳"],
      "must_conditions": ["匹配指南具体方向和技术指标", "按方向落实自筹资金比例"],
      "evidence_required": ["项目方向", "技术指标", "交付物", "项目周期", "自筹资金证明"],
      "benefit_summary": "按指南方向提供项目资助，具体比例以官方指南为准。",
      "application_channel": "上海市科技管理信息系统"
    },
    {
      "policy_id": "SH-CT-2026-002",
      "title": "2026年可再生能源和新能源专项资金奖励项目申报及拨付通知",
      "issuer": "上海市发展和改革委员会",
      "document_number": "沪发改能源〔2025〕249号",
      "source_url": "https://fgw.sh.gov.cn/fgw_ny/20251225/254cbaecdcf84aa192176a61f5cb86f8.html",
      "published_at": "2025-12-25",
      "application_open_at": "2026-01-01",
      "application_close_at": "2026-08-31",
      "status_mode": "application_window",
      "opportunity_type": "renewable_energy_reward",
      "eligible_regions": ["上海"],
      "eligible_entities": ["企业投资项目"],
      "eligible_stages": ["pilot", "early_commercial", "scaling", "mature"],
      "sectors": ["光伏", "风电", "新能源"],
      "industry_tags": ["清洁能源", "新能源", "光伏", "风电"],
      "stage_tags": ["试点", "早期商业化", "规模化", "成熟"],
      "need_tags": ["项目奖励", "项目融资"],
      "technology_tags": ["光伏", "海上风电", "光伏建筑一体化"],
      "geography_tags": ["上海"],
      "market_tags": ["可再生能源"],
      "must_conditions": ["投资主体、备案主体和奖励申请主体一致", "完成项目备案和并网投产核验"],
      "exclusion_conditions": ["同一项目重复享受其他市级专项资金"],
      "evidence_required": ["备案文件", "并网投产日期", "装机量", "项目所在区", "其他市级资金声明"],
      "benefit_summary": "对符合专项办法和年度通知的项目提供奖励。",
      "application_channel": "新能源云"
    },
    {
      "policy_id": "SH-CT-2026-003",
      "title": "上海市可再生能源和新能源发展专项资金扶持办法",
      "issuer": "上海市发展和改革委员会、上海市财政局",
      "document_number": "沪发改规范〔2022〕14号",
      "source_url": "https://fgw.sh.gov.cn/fgw_gfxwj/20221124/afdeb03a646a44f8bebc49e0c45870aa.html",
      "published_at": "2022-11-24",
      "effective_from": "2022-11-24",
      "effective_to": "2026-12-31",
      "status_mode": "framework_only",
      "opportunity_type": "funding_framework",
      "eligible_regions": ["上海"],
      "eligible_entities": ["项目投资主体"],
      "eligible_stages": ["early_commercial", "scaling", "mature"],
      "sectors": ["海上风电", "光伏", "光伏建筑一体化"],
      "industry_tags": ["清洁能源", "新能源", "光伏", "风电"],
      "stage_tags": ["早期商业化", "规模化", "成熟"],
      "need_tags": ["项目奖励", "项目融资"],
      "technology_tags": ["海上风电", "光伏", "光伏建筑一体化"],
      "geography_tags": ["上海"],
      "market_tags": ["可再生能源"],
      "must_conditions": ["项目在政策规定期间投产发电", "结合年度申报通知核验"],
      "exclusion_conditions": ["同一项目重复享受其他市级专项资金"],
      "evidence_required": ["项目备案", "并网投产证明", "申报主体一致性"],
      "benefit_summary": "专项资金制度依据，具体机会需与年度通知组合判断。"
    },
    {
      "policy_id": "SH-CT-2026-004",
      "title": "2026年度上海市工业通信业节能减排和合同能源管理专项资金项目申报",
      "issuer": "上海市经济和信息化委员会",
      "document_number": "沪经信绿〔2026〕189号",
      "source_url": "https://sheitc.sh.gov.cn/cyfz/20260414/1e15425f982a4811ae74ab2d27222e70.html",
      "published_at": "2026-04-14",
      "effective_to": "2026-12-31",
      "status_mode": "ongoing",
      "opportunity_type": "energy_efficiency_fund",
      "eligible_regions": ["上海"],
      "eligible_entities": ["企业", "事业单位"],
      "eligible_stages": ["early_commercial", "scaling", "mature"],
      "sectors": ["工业节能", "绿色制造", "合同能源管理", "清洁生产"],
      "industry_tags": ["工业", "清洁能源", "节能减排"],
      "stage_tags": ["早期商业化", "规模化", "成熟"],
      "need_tags": ["节能改造", "专项资金", "绿色制造"],
      "technology_tags": ["节能技术", "能源管理系统", "清洁生产"],
      "geography_tags": ["上海"],
      "market_tags": ["工业脱碳"],
      "must_conditions": ["依法设立并可独立承担民事责任", "经营、财务和信用状态正常", "具备能源计量体系"],
      "evidence_required": ["节能量证明", "稳定运行记录", "能源计量资料", "信用和财务资料"],
      "benefit_summary": "支持节能技改、合同能源管理、能源管理中心和绿色制造等项目。"
    },
    {
      "policy_id": "SH-STARTUP-2026-001",
      "title": "上海市2026年度科技型中小企业评价工作通知",
      "issuer": "上海市科学技术委员会",
      "source_url": "https://kjgl.stcsm.sh.gov.cn/wdcms/xmsb/1696.jhtml",
      "published_at": "2026-06-11",
      "application_open_at": "2026-06-11",
      "application_close_at": "2026-08-31",
      "status_mode": "application_window",
      "opportunity_type": "sme_evaluation",
      "eligible_regions": ["上海"],
      "eligible_entities": ["科技型中小企业"],
      "eligible_stages": ["research_development", "pilot", "early_commercial", "scaling"],
      "sectors": ["科技企业"],
      "industry_tags": ["科技企业", "清洁技术"],
      "stage_tags": ["研发", "试点", "早期商业化", "规模化"],
      "need_tags": ["企业资质", "研发认定"],
      "technology_tags": ["研发"],
      "geography_tags": ["上海"],
      "market_tags": ["科技型中小企业"],
      "must_conditions": ["符合科技型中小企业评价条件", "无应排除的严重失信或经营异常"],
      "evidence_required": ["人员和科技人员比例", "研发费用", "知识产权", "主导产品", "信用记录"],
      "benefit_summary": "完成科技型中小企业评价，具体后续支持以相关政策为准。",
      "application_channel": "优质中小企业梯度培育平台"
    },
    {
      "policy_id": "SH-STARTUP-2026-002",
      "title": "上海市2026年度高新技术企业认定工作通知",
      "issuer": "上海市科学技术委员会",
      "document_number": "沪科〔2026〕89号",
      "source_url": "https://stcsm.sh.gov.cn/zwgk/tzgs/zhtz/20260430/afacb50e07e74d27b3b852123654c1ab.html",
      "published_at": "2026-04-30",
      "application_open_at": "2026-04-30",
      "application_close_at": "2026-10-10",
      "status_mode": "application_window",
      "opportunity_type": "high_tech_enterprise_certification",
      "eligible_regions": ["上海"],
      "eligible_entities": ["企业"],
      "eligible_stages": ["early_commercial", "scaling", "mature"],
      "sectors": ["高新技术"],
      "industry_tags": ["高新技术", "清洁技术"],
      "stage_tags": ["早期商业化", "规模化", "成熟"],
      "need_tags": ["高新技术企业认定", "研发资质"],
      "technology_tags": ["研发", "知识产权"],
      "geography_tags": ["上海"],
      "market_tags": ["科技企业"],
      "must_conditions": ["满足高新技术企业认定条件"],
      "evidence_required": ["知识产权", "研发项目", "成果转化", "科技人员", "研发费用", "高新技术产品收入", "专项审计", "财务报告", "纳税申报表"],
      "benefit_summary": "高新技术企业认定入口，不代表自动通过。"
    },
    {
      "policy_id": "SH-FIN-2026-001",
      "title": "上海市科技贷款保费补贴申请通知",
      "issuer": "上海市科学技术委员会",
      "document_number": "沪科〔2026〕123号",
      "source_url": "https://stcsm.sh.gov.cn/zwgk/tzgs/zhtz/20260528/f4790a84d55f43f38696b98b6e5970f1.html",
      "published_at": "2026-05-28",
      "status_mode": "ongoing",
      "opportunity_type": "loan_insurance_subsidy",
      "eligible_regions": ["上海"],
      "eligible_entities": ["科技型中小企业"],
      "eligible_stages": ["early_commercial", "scaling"],
      "sectors": ["科技企业融资"],
      "industry_tags": ["科技企业", "清洁技术"],
      "stage_tags": ["早期商业化", "规模化"],
      "need_tags": ["贷款", "融资成本", "保费补贴"],
      "technology_tags": ["研发"],
      "geography_tags": ["上海"],
      "market_tags": ["科技金融"],
      "must_conditions": ["属于履约责任保证保险或担保贷款授信企业", "已履行还款义务或取得无还本续贷批复", "无严重失信"],
      "evidence_required": ["授信和贷款合同", "保费支付证明", "还款或续贷证明", "信用记录"],
      "benefit_summary": "可能进入免申即享核验，补贴比例和结果以官方核验为准。"
    },
    {
      "policy_id": "SH-SERVICE-2026-001",
      "title": "上海市2026年度技术先进型服务企业认定工作通知",
      "issuer": "上海市科学技术委员会",
      "source_url": "https://stcsm.sh.gov.cn/zwgk/tzgs/zhtz/20260305/34ca13f25cb2491dade6804597a4236d.html",
      "published_at": "2026-03-05",
      "application_open_at": "2026-03-05",
      "application_close_at": "2026-08-31",
      "status_mode": "application_window",
      "opportunity_type": "advanced_service_enterprise_certification",
      "eligible_regions": ["上海"],
      "eligible_entities": ["服务企业"],
      "eligible_stages": ["early_commercial", "scaling", "mature"],
      "sectors": ["ITO", "BPO", "KPO", "服务贸易"],
      "industry_tags": ["科技服务", "服务贸易"],
      "stage_tags": ["早期商业化", "规模化", "成熟"],
      "need_tags": ["企业认定", "服务贸易"],
      "technology_tags": ["信息技术服务", "知识流程外包"],
      "geography_tags": ["上海"],
      "market_tags": ["离岸服务", "服务贸易"],
      "must_conditions": ["业务属于认定范围", "满足服务收入和离岸业务证明要求"],
      "evidence_required": ["服务合同", "发票", "收汇证明", "员工学历", "收入结构"],
      "benefit_summary": "技术先进型服务企业认定入口，仅适用于相应服务业务。"
    },
    {
      "policy_id": "SH-INNOVATION-2025-001",
      "title": "上海市科技创新券管理办法",
      "issuer": "上海市科学技术委员会、上海市财政局",
      "document_number": "沪科规〔2025〕6号",
      "source_url": "https://stcsm.sh.gov.cn/zwgk/kjzc/zcwj/kwzcxwj/20250813/9e1982a4cd544e89b0ffddb1a108d5b6.html",
      "published_at": "2025-08-13",
      "effective_from": "2025-09-01",
      "effective_to": "2030-08-31",
      "status_mode": "ongoing",
      "opportunity_type": "innovation_voucher",
      "eligible_regions": ["上海"],
      "eligible_entities": ["科技型中小企业", "创业团队"],
      "eligible_stages": ["research_development", "pilot", "early_commercial"],
      "sectors": ["科技创新服务"],
      "industry_tags": ["科技企业", "清洁技术"],
      "stage_tags": ["研发", "试点", "早期商业化"],
      "need_tags": ["研发服务", "检验检测", "知识产权", "科技金融"],
      "technology_tags": ["研发", "技术转移", "检验检测"],
      "geography_tags": ["上海"],
      "market_tags": ["科技服务"],